{"schema_version":"1.1","update_id":"SM-UPD-000001","update_version":"0.3.1","source_commit":"0000000000000000000000000000000000000000","created_at":"2026-07-11T00:00:00Z","minimum_project_version":"0.3.0","maximum_project_version":"0.3.x","reversible":true,"human_approval_required":true,"affected_components":["metadata"],"operations":[],"rollback_contract":{"mode":"CHECKPOINT_AND_INVERSE_PLAN","verify_hashes":true,"restore_baseline":true}}
